<?xml version="1.0" encoding="UTF-8"?>
<!--
########### SVN repository information ###################
# $Date$
# $Author$
# $Revision$
# $HeadURL$
# $Id$
########### SVN repository information ###################
-->
<definition xmlns="http://www.nexusformat.org"
    xmlns:xsi="http://www.w3.org/2001/XMLSchema-instance"
    xsi:schemaLocation="http://www.nexusformat.org nxdl.xsd"
    name="NXlog" 
    type="group" extends="NXobject">
    <doc>Definition of logged information, i.e. information monitored during the run. They contain
        the logged values and the times at which they were measured as elapsed time since a starting
        time recorded in ISO8601 format. This method of storing logged data helps to distinguish
        instances in which a variable is a dimension scale of the data, in which case it is stored
        in an NXdata group, and instances in which it is logged during the run, when it should be
        stored in an NXlog group.</doc>
	<field name="time" type="NX_FLOAT">
		<doc>
			Time of logged entry. The times are relative to the "start" attribute 
			and in the units specified in the "units" attribute.
        </doc>
        <attribute name="start" type="NX_DATE_TIME" />
	</field>
	<field name="value" units="NX_ANY" type="NX_NUMBER">
		<doc>Array of logged value, such as temperature</doc>
	</field>
	<field name="raw_value" units="NX_ANY" type="NX_NUMBER">
		<doc>Array of raw information, such as thermocouple voltage</doc>
	</field>
	<field name="description">
		<doc>Description of logged value</doc>
	</field>
	<field name="average_value" type="NX_FLOAT" units="NX_ANY">
	</field>
	<field name="average_value_error" type="NX_FLOAT" units="NX_ANY">
		<doc>standard deviation of average_value</doc>
	</field>
	<field name="minimum_value" type="NX_FLOAT" units="NX_ANY">
	</field>
	<field name="maximum_value" type="NX_FLOAT" units="NX_ANY">
	</field>
	<field name="duration" type="NX_FLOAT" units="NX_ANY">
		<doc>Total time log was taken</doc>
	</field>
</definition>