<?xml version="1.0" encoding="UTF-8"?>
<!--
########### SVN repository information ###################
# $Date$
# $Author$
# $Revision$
# $HeadURL$
# $Id$
########### SVN repository information ###################
-->
<definition xmlns="http://www.nexusformat.org"
    xmlns:xsi="http://www.w3.org/2001/XMLSchema-instance"
    xsi:schemaLocation="http://www.nexusformat.org nxdl.xsd"
    name="NXnote" 
    type="group" extends="NXobject">
	<doc>This class can be used to store additional information in a 
		NeXus file e.g. pictures, movies, audio, additional text logs
	</doc>
	<field name="author">
		<doc>Author or creator of note</doc>
	</field>
	<field name="date" type="NX_DATE_TIME">
		<doc>Date note created/added</doc>
	</field>
	<field name="type">
		<doc>Mime content type of note data field e.g. image/jpeg, text/plain, text/html}</doc>
	</field>
	<field name="file_name">
		<doc>Name of original file name if note was read from an external source</doc>
	</field>
	<field name="description">
		<doc>Title of an image or other details of the note</doc>
	</field>
	<field name="data" type="NX_BINARY">
		<doc>Binary note data - if text, line terminator is [CR][LF].</doc>
	</field>
</definition>
