<?xml version="1.0" encoding="UTF-8"?>
<!--
########### SVN repository information ###################
# $Date$
# $Author$
# $Revision$
# $HeadURL$
# $Id$
########### SVN repository information ###################
-->
<definition xmlns="http://www.nexusformat.org"
    xmlns:xsi="http://www.w3.org/2001/XMLSchema-instance"
    xsi:schemaLocation="http://www.nexusformat.org nxdl.xsd"
    name="NXbending_magnet" 
	type="group" extends="NXobject">

	<doc>description for a bending magnet</doc>
	<field name="critical_energy" type="NX_FLOAT" />
	<field name="bending_radius" type="NX_FLOAT" />
	<group type="NXdata"><doc>bending magnet spectrum</doc></group>
	<group type="NXgeometry"><doc>Engineering" position of bending magnet</doc></group>
</definition>
