<?xml version="1.0" encoding="UTF-8"?>
<!--
# NeXus - Neutron and X-ray Common Data Format
# 
# Copyright (C) 2008-2010 NeXus International Advisory Committee (NIAC)
# 
# This library is free software; you can redistribute it and/or
# modify it under the terms of the GNU Lesser General Public
# License as published by the Free Software Foundation; either
# version 3 of the License, or (at your option) any later version.
#
# This library is distributed in the hope that it will be useful,
# but WITHOUT ANY WARRANTY; without even the implied warranty of
# MERCHANTABILITY or FITNESS FOR A PARTICULAR PURPOSE.  See the GNU
# Lesser General Public License for more details.
#
# You should have received a copy of the GNU Lesser General Public
# License along with this library; if not, write to the Free Software
# Foundation, Inc., 59 Temple Place, Suite 330, Boston, MA  02111-1307  USA
#
# For further information, see http://www.nexusformat.org

########### SVN repository information ###################
# $Date: 2010-07-21 15:17:14 +0200 (Wed, 21 Jul 2010) $
# $Author: Mark Koennecke $
# $Revision: 567 $
# $HeadURL: https://svn.nexusformat.org/definitions/trunk/applications/NXtofraw.nxdl.xml $
# $Id: NXtofraw.nxdl.xml 567 2010-07-21 13:17:14Z Mark Koennecke $
########### SVN repository information ###################
-->
<definition name="NXdirecttof" extends="NXtofraw" type="group"
  category="application"
    xmlns="http://definition.nexusformat.org/nxdl/3.1"
    xmlns:xsi="http://www.w3.org/2001/XMLSchema-instance"
    xsi:schemaLocation="http://definition.nexusformat.org/nxdl/3.1 ../nxdl.xsd"
    version="1.0b"
    svnid="$Id: NXdirecttof.nxdl.xml 567 2010-07-21 13:17:14Z Mark Koennecke $">
    <doc>This is a application definition for raw data from a direct geometry TOF spectrometer</doc>
    <group type="NXentry" name="entry">
      <field name="title" />
      <field name="start_time" type="NX_DATE_TIME" />
      <field name="definition">
        <doc> Official NeXus NXDL schema to which this file conforms </doc>
        <enumeration>
          <item value="NXdirecttof"/>
        </enumeration>
      </field>
     <group type="NXinstrument">
       <group type="NXfermi_chopper" name="fermi_chopper">
        <field name="rotation_speed" type="NX_FLOAT" units="NX_FREQUENCY">
          <doc>chopper rotation speed</doc>
        </field>
       <field name="energy" type="NX_FLOAT" units="NX_ENERGY">
            <doc>energy selected</doc>
       </field> 
       </group>
     </group>  
    </group>
</definition>
