<?xml version="1.0" encoding="UTF-8"?>
<!--
########### SVN repository information ###################
# $Date$
# $Author$
# $Revision$
# $HeadURL$
# $Id$
########### SVN repository information ###################
-->
<definition xmlns="http://www.nexusformat.org"
    xmlns:xsi="http://www.w3.org/2001/XMLSchema-instance"
    xsi:schemaLocation="http://www.nexusformat.org nxdl.xsd"
    name="NXshape" 
	type="group" extends="NXobject">
	<doc>
		This is the description of the general shape and size of a 
		component, which may be made up of "numobj" separate 
		elements - it is used by the NXgeometry class
	</doc>
	<attribute name="name" type="NX_CHAR" />
	<field name="shape" type="NX_CHAR">
		<doc>"nxcylinder", "nxbox", "nxsphere", ...</doc>
	</field>
	<field name="size" type="NX_FLOAT" units="NX_LENGTH">
		<doc>
			physical extent of the object along its local axes (after NXorientation) 
			with the center of mass at the local origin (after NXtranslate).
			The meaning and location of these axes will vary according to the value 
			of the "shape" variable. nshapepar defines how many parameters. For the 
			"nxcylinder" type the paramters are (diameter,height). For the "nxbox" type 
			the parameters are (length,width,height). For the "nxsphere" type the 
			parameters are (diameter).
		</doc>
		<dimensions>[numobj,nshapepar]</dimensions>
	</field>
</definition>

