<?xml version="1.0" encoding="UTF-8"?>
<!--
########### SVN repository information ###################
# $Date$
# $Author$
# $Revision$
# $HeadURL$
# $Id$
########### SVN repository information ###################
-->
<definition xmlns="http://www.nexusformat.org"
    xmlns:xsi="http://www.w3.org/2001/XMLSchema-instance"
    xsi:schemaLocation="http://www.nexusformat.org nxdl.xsd"
    name="NXgeometry" 
	type="group" extends="NXobject">
    <doc>This is the description for a general position of a component. Note that every instance of
        an NXgeometry should be named "geometry" so that it can be linked to (linked items must
        share the same name in HDF)</doc>
    <group type="NXshape">
        <doc>shape/size information of component</doc>
    </group>
    <group type="NXtranslation">
        <doc>translation of component</doc>
    </group>
    <group type="NXorientation">
        <doc>orientation of component</doc>
    </group>
    <field name="description">
        <doc>Optional description/label. Probably only present if we are an additional reference
            point for components rather than the location of a real component</doc>
    </field>
    <field name="component_index" type="NX_INT">
        <doc>Position of the component along the beam path. The sample is at 0, components upstream
            have negative component_index, components downstream have positive
        component_index.</doc>
    </field>
</definition>

