<?xml version="1.0" encoding="UTF-8"?>
<!--
########### SVN repository information ###################
# $Date$
# $Author$
# $Revision$
# $HeadURL$
# $Id$
########### SVN repository information ###################
-->
<definition xmlns="http://www.nexusformat.org"
    xmlns:xsi="http://www.w3.org/2001/XMLSchema-instance"
    xsi:schemaLocation="http://www.nexusformat.org nxdl.xsd"
    name="NXentry" 
	type="group" extends="NXobject">
	<doc>
		Template of the top-level NeXus group which contains all the data and associated information that comprise a single measurement. It is mandatory that there is at least one group of this type in the NeXus file.
	</doc>
	<field name="title" type="NX_CHAR"><doc>Extended title for entry</doc></field>
	<field name="experiment_identifier" type="NX_CHAR" dims="[]"><doc>Unique identifier for the experiment, defined by the facility, possibly linked to the proposals</doc></field>
	<field name="experiment_description" type="NX_CHAR"><doc>Brief summary of the experiment, including key objectives.</doc></field>
	<group type="NXnote"  name="experiment_documentation"><doc>Description of the full experiment (document in pdf, latex, â€¦)</doc></group>
	<field name="collection_identifier" type="NX_CHAR"><doc>User or Data Acquisition defined group of NeXus files or NXentry</doc></field>
	<field name="collection_description" type="NX_CHAR"><doc>Brief summary of the collection, including grouping criteria.</doc></field>
	<field name="entry_identifier" type="NX_CHAR"><doc>unique identifier for the measurement, defined by the facility.</doc></field>
	<field name="definition" type="NX_CHAR">
		<doc>Name of entry DTD</doc>
		<attribute name="version" type="NX_CHAR"><doc>DTD version number</doc></attribute>
		<attribute name="URL" type="NX_CHAR"><doc>URL of DTD file</doc></attribute>
	</field>
	<field name="definition_local" type="NX_CHAR">
		<doc>Name of entry DTD</doc>
		<attribute name="version" type="NX_CHAR"><doc>DTD version number</doc></attribute>
		<attribute name="URL" type="NX_CHAR"><doc>URL of DTD file</doc></attribute>
	</field>
	<field name="start_time" type="ISO8601"><doc>Starting time of measurement</doc></field>
	<field name="end_time" type="ISO8601"><doc>Ending time of measurement</doc></field>
	<field name="duration" type="NX_INT" units="seconds"><doc>Duration of measurement</doc></field>
	<field name="collection_time" type="NX_FLOAT" units="seconds">
		<doc>
			Time transpired actually collecting data i.e. taking out time when collection was suspended due to e.g. temperature out of range
		</doc>
	</field>
	<field name="run_cycle" type="NX_CHAR" dims="[]" />
	<field name="program_name" type="NX_CHAR">
		<doc>Name of program used to generate this file</doc>
		<attribute name="version" type="NX_CHAR"><doc>{Program version number</doc></attribute>
		<attribute name="configuration" type="NX_CHAR"><doc>{configuration of the program</doc></attribute>
	</field>
	<field name="revision" type="NX_CHAR">
		<doc>Revision id of the file due to re-calibration, reprocessing, new analysis, new instrument definition format, ...</doc>
		<attribute name="comment" type="NX_CHAR" />
	</field>
	<field name="notes" type="NX_CHAR"><doc>Notes describing entry</doc></field>
	<group name="thumbnail" type="NXnote">
		<doc>
			A small image that is representative of the entry.
			An example of this is a 640x480 jpeg image automatically produced by a low resolution plot of the NXdata.
		</doc>
		<attribute name="mime_type" type="NX_CHAR">
			<enumeration>
				<item value="image/*" />
			</enumeration>
		</attribute>
	</group>
	<group type="NXcharacterization" />
	<group type="NXuser" />
	<group type="NXsample" />
	<group type="NXinstrument" />
	<group type="NXmonitor" />
	<group type="NXdata" />
	<group type="NXprocess" />
</definition>

