<?xml version="1.0" encoding="UTF-8"?>
<definition xmlns="http://www.nexusformat.org"
    xmlns:xsi="http://www.w3.org/2001/XMLSchema-instance"
    xsi:schemaLocation="http://www.nexusformat.org nxdl.xsd"
    name="NXaperture" type="group" extends="NXobject">
    <doc>Template of a beamline aperture.</doc>
    <group type="NXgeometry">
        <doc>location and shape of aperture</doc>
    </group>
    <field name="material" type="NX_CHAR">
        <doc>Absorbing material of the aperture</doc>
    </field>
    <field name="description" type="NX_CHAR">
        <doc>Description of aperture</doc>
    </field>
</definition>