<?xml version="1.0" encoding="UTF-8"?>
<!--
########### SVN repository information ###################
# $Date$
# $Author$
# $Revision$
# $HeadURL$
# $Id$
########### SVN repository information ###################
-->
<definition xmlns="http://www.nexusformat.org"
    xmlns:xsi="http://www.w3.org/2001/XMLSchema-instance"
    xsi:schemaLocation="http://www.nexusformat.org nxdl.xsd"
    name="NXvelocity_selector" 
	type="group" extends="NXobject">
	<doc>This is the description for a (typically neutron) velocity selector</doc>
	<field name="type">
		<doc>velocity selector type</doc>
	</field>
	<field name="rotation_speed" type="NX_FLOAT" units="NX_FREQUENCY">
		<doc>velocity selector rotation speed</doc>
	</field>
	<field name="radius" type="NX_FLOAT" units="NX_LENGTH">
		<doc>radius at beam centre</doc>
	</field>
	<field name="spwidth" type="NX_FLOAT" units="NX_LENGTH">
		<doc>spoke width at beam centre</doc>
	</field>
	<field name="length" type="NX_FLOAT" units="NX_LENGTH">
		<doc>rotor length</doc>
	</field>
	<field name="num" type="NX_INT">
		<doc>number of spokes/lamella</doc>
	</field>
	<field name="twist" type="NX_FLOAT" units="NX_ANGLE">
		<doc>twist angle along axis</doc>
	</field>
	<field name="table" type="NX_FLOAT" units="NX_ANGLE">
		<doc>offset vertical angle</doc>
	</field>
	<field name="height" type="NX_FLOAT" units="NX_LENGTH">
		<doc>input beam height</doc>
	</field>
	<field name="width" type="NX_FLOAT" units="NX_LENGTH">
		<doc>input beam width</doc>
	</field>
	<field name="wavelength" type="NX_FLOAT" units="NX_WAVELENGTH">
		<doc>wavelength</doc>
	</field>
	<field name="wavelength_spread" type="NX_FLOAT">
		<doc>deviation FWHM /Wavelength</doc>
	</field>
</definition>

