<?xml version="1.0" encoding="UTF-8"?>
<!--
# NXtechnical_data: candidate NeXus base class definition

########### SVN repository information ###################
# $Date$
# $Author$
# $Revision$
# $HeadURL$
# $Id$
########### SVN repository information ###################
-->
<definition xmlns="http://definition.nexusformat.org/nxdl/3.1" category="contributed"
    xmlns:xsi="http://www.w3.org/2001/XMLSchema-instance"
    xsi:schemaLocation="http://definition.nexusformat.org/nxdl/3.1 ../nxdl.xsd"
    name="NXtechnical_data" version="1.0"
    svnid="$Id$" type="group"
    extends="NXobject">

    <doc>(definition implied by usage) Some measure of metadata not already considered by the other
        base classes. This class appears in the example data files provided from Soleil. This class
        should be considered as a base class (and relocated there, once approved by the NIAC). This
        class is used by Soleil as a child of (at least) these classes: NXsai_controller,
        NXdetector, NXsource </doc>

    <field name="data" type="NX_NUMBER" units="NX_ANY">
        <doc>The value(s) of this class. Examples from Soleil show this used as float (64-bit or
            32-bit), integer, or unsigned 8-bit char</doc>
        <attribute name="units">
            <doc>Engineering units</doc>
        </attribute>
        <attribute name="timestamp" type="NX_DATE_TIME">
            <doc>date and time when this value was obtained.</doc>
        </attribute>
        <attribute name="description">
            <doc>something useful about this data field</doc>
        </attribute>
    </field>

    <field name="description">
        <doc>{documentation for this instance of NXtechnical_data}</doc>
        <attribute name="description">
            <doc>something useful about this decription field</doc>
        </attribute>
    </field>

</definition>
