<?xml version="1.0" encoding="UTF-8"?>
<!--
########### SVN repository information ###################
# $Date$
# $Author$
# $Revision$
# $HeadURL$
# $Id$
########### SVN repository information ###################
-->
<definition xmlns="http://www.nexusformat.org"
    xmlns:xsi="http://www.w3.org/2001/XMLSchema-instance"
    xsi:schemaLocation="http://www.nexusformat.org nxdl.xsd"
    name="NXdata" 
	type="group" extends="NXobject">
	<doc>
		Template of plottable data and their dimension scales. It is mandatory 
		that there is at least one group of this type in each NXentry group.  
		Note that "variable" and "data" can be defined with different names.  
		The "signal" and "axes" attribute of the "data" item define which items 
		are plottable data and which are dimension scales.
	</doc>
	<field name="variable" type="NX_FLOAT[:]|NX_INT[:]">
		<!-- 
			long_name="{Axis label}" distribution="0|1" 
			first_good="{Index of first good value}" 
			last_good="{Index of last good value}"
		 -->
	 	<doc>Dimension scale defining an axis of the data</doc>
	</field>
	<field name="variable_errors" type="NX_FLOAT[:]|NX_INT[:]">
		<doc>Errors associated with axis "variable"</doc>
	</field>
	<field name="data" type="NX_FLOAT[:...]|NX_INT[:...]">
		<!-- attributes
			signal="1" 
			axes="[...]" 
			long_name="{Title of data}"
		 -->
		 <doc>Data values</doc>
	</field>
	<field name="errors" type="NX_FLOAT[:...]">
		<doc>
			Standard deviations of data values - 
			the data array is identified by the attribute signal="1". 
			This array must have the same dimensions as the data
		</doc>
	</field>
</definition>

