<?xml version="1.0" encoding="UTF-8"?>
<!--
########### SVN repository information ###################
# $Date$
# $Author$
# $Revision$
# $HeadURL$
# $Id$
########### SVN repository information ###################
-->
<definition xmlns="http://www.nexusformat.org"
    xmlns:xsi="http://www.w3.org/2001/XMLSchema-instance"
    xsi:schemaLocation="http://www.nexusformat.org nxdl.xsd"
    name="NXpolarizer" 
	type="group" extends="NXobject">
    <doc>Template of a beamline spin polarizer.
        
        This is a first cut. This is NOT the last word.</doc>
    <field name="type" type="NX_CHAR">
        <doc>crystal,supermirror</doc>
    </field>
    <field name="composition" type="NX_CHAR"/>
    <field name="reflection" type="NX_INT">
        <doc>[hkl] values of nominal reflection</doc>
        <dimensions>3</dimensions>
    </field>
    <field name="efficiency" type="NX_CHAR">
        <doc>polarizing efficiency</doc>
    </field>
</definition>

