<?xml version="1.0" encoding="UTF-8"?>
<!--
########### SVN repository information ###################
# $Date$
# $Author$
# $Revision$
# $HeadURL$
# $Id$
########### SVN repository information ###################
-->
<definition xmlns="http://www.nexusformat.org"
    xmlns:xsi="http://www.w3.org/2001/XMLSchema-instance"
    xsi:schemaLocation="http://www.nexusformat.org nxdl.xsd"
    name="NXfermi_chopper" 
	type="group" extends="NXobject">
	<doc>Description of a Fermi chopper, possibly with curved slits.</doc>
	<field name="type">
		<doc>Fermi chopper type</doc>
	</field>
	<field name="rotation_speed" type="NX_FLOAT" units="NX_FREQUENCY">
		<doc>chopper rotation speed</doc>
	</field>
	<field name="radius" type="NX_FLOAT" units="NX_LENGTH">
		<doc>radius of chopper</doc>
	</field>
	<field name="slit" type="NX_FLOAT" units="NX_LENGTH">
		<doc>width of an individual slit</doc>
	</field>
	<field name="r_slit" type="NX_FLOAT" units="NX_LENGTH">
		<doc>radius of curvature of slits</doc>
	</field>
	<field name="num" type="NX_INT">
		<doc>number of slits</doc>
	</field>
	<field name="height" type="NX_FLOAT" units="NX_LENGTH">
		<doc>input beam height</doc>
	</field>
	<field name="width" type="NX_FLOAT" units="NX_LENGTH">
		<doc>input beam width</doc>
	</field>
	<field name="wavelength" type="NX_FLOAT">
		<!-- should have units of Angstroms or nm or pm -->
		<doc>Wavelength transmitted by chopper</doc>
	</field>
	<group type="NXgeometry">
		<doc>geometry of the fermi chopper</doc>
	</group>
	<field name="absorbing_material">
		<doc>absorbing material</doc>
	</field>
	<field name="transmitting_material">
		<doc>transmitting material</doc>
	</field>
</definition>

