<?xml version="1.0" encoding="UTF-8"?>
<!--
########### SVN repository information ###################
# $Date$
# $Author$
# $Revision$
# $HeadURL$
# $Id$
########### SVN repository information ###################
-->
<definition xmlns="http://www.nexusformat.org"
    xmlns:xsi="http://www.w3.org/2001/XMLSchema-instance"
    xsi:schemaLocation="http://www.nexusformat.org nxdl.xsd"
    name="NXenvironment" 
	type="group" extends="NXobject">
	<doc>This class describes an external condition applied to the sample</doc>
	<field name="name" type="NX_CHAR"><doc>Apparatus identification code/model number; e.g. OC100 011</doc></field>
	<field name="short_name" type="NX_CHAR"><doc>Alternative short name, perhaps for dashboard display like a present Seblock name</doc></field>
	<field name="type" type="NX_CHAR"><doc>Type of apparatus. This could be the SE codes in scheduling database; e.g. OC/100</doc></field>
	<field name="description" type="NX_CHAR"><doc>Description of the apparatus; e.g. 100mm bore orange cryostat with Roots pump</doc></field>
	<field name="program" type="NX_CHAR"><doc>Program controlling the apparatus; e.g. LabView VI name</doc></field>
	<group name="position" type="NXgeometry"><doc>The position and orientation of the apparatus</doc></group>
	<group type="NXnote"><doc>Additional information, LabView logs, digital photographs, etc</doc></group>
	<group type="NXsensor" />
</definition>

