<?xml version="1.0" encoding="UTF-8"?>
<!--
########### SVN repository information ###################
# $Date$
# $Author$
# $Revision$
# $HeadURL$
# $Id$
########### SVN repository information ###################
-->
<definition xmlns="http://www.nexusformat.org"
    xmlns:xsi="http://www.w3.org/2001/XMLSchema-instance"
    xsi:schemaLocation="http://www.nexusformat.org nxdl.xsd"
    name="NXuser" 
	type="group" extends="NXobject">
	<doc>
		Template of user's contact information.  The format allows more 
		than one user with the same affiliation and contact information, 
		but a second NXuser group should be used if they have different 
		affiliations, etc.
	</doc>
	<field name="name">
		<doc>Name of user responsible for this entry</doc>
	</field>
	<field name="role">
		<doc>
			Role of user responsible for this entry.
			Suggested roles are "local_contact", 
			"principal_investigator", and "proposer"
		</doc>
	</field>
	<field name="affiliation">
		<doc>Affiliation of user</doc>
	</field>
	<field name="address">
		<doc>Address of user</doc>
	</field>
	<field name="telephone_number">
		<doc>Telephone number of user</doc>
	</field>
	<field name="fax_number">
		<doc>Fax number of user</doc>
	</field>
	<field name="email">
		<doc>Email of user</doc>
	</field>
	<field name="facility_user_id">
		<doc>
			facility based unique identifier for this person 
			e.g. their identification code on the facility 
			address/contact database
		</doc>
	</field>
</definition>

