<?xml version="1.0" encoding="UTF-8"?>
<!--
########### SVN repository information ###################
# $Date$
# $Author$
# $Revision$
# $HeadURL$
# $Id$
########### SVN repository information ###################
-->
<definition xmlns="http://www.nexusformat.org"
    xmlns:xsi="http://www.w3.org/2001/XMLSchema-instance"
    xsi:schemaLocation="http://www.nexusformat.org nxdl.xsd"
    name="NXinstrument" 
    type="group" extends="NXobject">
	<doc>
		Template of instrument descriptions comprising various beamline components. 
		Each component will also be a NeXus group defined by its distance from the 
		sample. Negative distances represent beamline components that are before the 
		sample while positive distances represent components that are after the sample. 
		This device allows the unique identification of beamline components in a way 
		that is valid for both reactor and pulsed instrumentation.
	</doc>
	<field name="name" type="NX_CHAR">
		<doc>Name of instrument</doc>
	</field>
	<group type="NXsource" />
	<group type="NXdisk_chopper" />
	<group type="NXfermi_chopper" />
	<group type="NXvelocity_selector" />
	<group type="NXguide" />
	<group type="NXcrystal" />
	<group type="NXaperture" />
	<group type="NXfilter" />
	<group type="NXcollimator" />
	<group type="NXattenuator" />
	<group type="NXpolarizer" />
	<group type="NXflipper" />
	<group type="NXmirror" />
	<group type="NXdetector" />
	<group type="NXbeam_stop" />
	<group type="NXcollimator" />
</definition>