<?xml version="1.0" encoding="UTF-8"?>
<definition  
	xmlns:xsi="http://www.w3.org/2001/XMLSchema-instance"
    xmlns="http://www.nexusformat.org"
	xsi:schemaLocation="http://www.nexusformat.org nxdl.xsd "
	
    name="NXfermi_chopper" 
    type="group" 
    extends="NXchopper">

    <group type="NXgeometry">
        <doc>geometry of the fermi chopper</doc>
    </group>
    <field name="type" type="NX_CHAR">
        <doc>fchopper type</doc>
    </field>
<!--    <bob flippy="123"/>-->
    <field name="radius" type="NX_LENGTH">
        <doc>radius of chopper</doc>
        <attribute name="colour" />
    </field>
</definition>
