<?xml version="1.0" encoding="UTF-8"?>
<?xml-stylesheet type="text/xsl" href="nxdlformat.xsl" ?>
<!--
# NXtechnical_data: candidate NeXus base class definition

########### SVN repository information ###################
# $Date$
# $Author$
# $Revision$
# $HeadURL$
# $Id$
########### SVN repository information ###################
-->
<definition xmlns="http://definition.nexusformat.org/nxdl/3.1" category="contributed"
    xmlns:xsi="http://www.w3.org/2001/XMLSchema-instance"
    xsi:schemaLocation="http://definition.nexusformat.org/nxdl/3.1 ../nxdl.xsd"
    name="NXsai_controller" version="1.0"
    svnid="$Id$" 
    type="group"
    extends="NXobject">

    <doc>(definition implied by usage) Subclass of NXinstrument used by Soleil. This class appears
        in the example data files provided from Soleil. This class should be considered as a base
        class (and relocated there, once approved by the NIAC). </doc>

    <!-- documentation taken from one of the Soleil example files -->
    <group type="NXtechnical_data" name="Frequency">
        <doc>DAQ board sampling frequency</doc>
    </group>
    <group type="NXtechnical_data" name="IntegrationTime">
        <doc>buffer integration time</doc>
    </group>
    <group type="NXtechnical_data" name="TriggerNumber">
        <doc>set to 0 at init, means that extern trigger mode disabled. if triggerNumber > 0, means
            extern trigger mode enabled. read part is the current trigger</doc>
    </group>
</definition>
