<?xml version="1.0" encoding="UTF-8"?>
<!--
    ########### SVN repository information ###################
    # $Date$
    # $Author$
    # $Revision$
    # $HeadURL$
    # $Id$
    ########### SVN repository information ###################
-->
<definition xmlns="http://www.nexusformat.org"
    xmlns:xsi="http://www.w3.org/2001/XMLSchema-instance"
    xsi:schemaLocation="http://www.nexusformat.org nxdl.xsd"
    name="NXroot" 
    type="group" extends="NXobject">
    <doc>Definition of the root NeXus group.</doc>
    <attribute name="file_name" type="NX_CHAR">
        <doc>File name of original NeXus file</doc>
    </attribute>
    <attribute name="file_update_time" type="NX_CHAR">
        <doc>Date and time of last file change at close</doc>
    </attribute>
    <attribute name="NeXus_version" type="NX_CHAR">
        <doc>Version of NeXus API used in writing the file</doc>
    </attribute>
    <attribute name="HDF_version" type="NX_CHAR">
        <doc>Version of NeXus API used in writing the file</doc>
    </attribute>
    <attribute name="HDF5_version" type="NX_CHAR">
        <doc>Version of NeXus API used in writing the file</doc>
    </attribute>
    <attribute name="creator" type="NX_CHAR">
        <doc>facility or program where file originated</doc>
    </attribute>
    <group type="NXentry" minOccurs="1" >
        <doc>entries</doc>
    </group>
</definition>

